citation,pmid
"Bae SH, Paik YK. Cholesterol biosynthesis from lanosterol: development of a novel assay method and characterization of rat liver microsomal lanosterol delta 24-reductase. Biochem J. 1997 Sep 1;326 ( Pt 2)(Pt 2):609–16.",9291139
"Dennis EA, Deems RA, Harkewicz R, Quehenberger O, Brown HA, Milne SB, et al. A mouse macrophage lipidome. J Biol Chem. 2010 Dec 17;285(51):39976–85.",20923771
"Bogan RL, Debarber AE, Hennebold JD. Liver x receptor modulation of gene expression leading to proluteolytic effects in primate luteal cells. Biol Reprod. 2012 Mar 30;86(3):89.",22156476
"Ačimovič J, Rozman D. Steroidal triterpenes of cholesterol synthesis. Molecules. 2013 Apr 4;18(4):4002–17.", 23558541
"Ačimovič J, Rozman D. Steroidal triterpenes of cholesterol synthesis. Molecules. 2013 Apr 4;18(4):4002–17.",23558541
