citation,pmid
"Kvittingen EA, Guldal G, Børsting S, Skalpe IO, Stokke O, Jellum E. N-acetylaspartic aciduria in a child with a progressive cerebral atrophy. Clin Chim Acta. 1986 Aug 15;158(3):217–27.",3769199
"Chalmers RA, Lawson AM, Watts RW, Tavill AS, Kamerling JP, Hey E, et al. D-2-hydroxyglutaric aciduria: case report and biochemical studies. J Inherit Metab Dis. 1980;3(1):11–5.",6774165
"Hoffmann GF, Böhles HJ, Burlina A, Duran M, Herwig J, Lehnert W, et al. Early signs and course of disease of glutaryl-CoA dehydrogenase deficiency. J Inherit Metab Dis. 1995;18(2):173–6.",7564239
"BANKER BQ, ROBERTSON JT, VICTOR M. SPONGY DEGENERATION OF THE CENTRAL NERVOUS SYSTEM IN INFANCY. Neurology. 1964 Nov;14:981–1001.",14239091
"Rzem R, Van Schaftingen E, Veiga-da-Cunha M. The gene mutated in l-2-hydroxyglutaric aciduria encodes l-2-hydroxyglutarate dehydrogenase. Biochimie. 2006 Jan;88(1):113–6.",16005139
"Hedlund GL, Longo N, Pasquali M. Glutaric acidemia type 1. Am J Med Genet C Semin Med Genet. 2006 May 15;142C(2):86–94.",16602100
"Arun P, Moffett JR, Namboodiri AMA. Evidence for mitochondrial and cytoplasmic N-acetylaspartate synthesis in SH-SY5Y neuroblastoma cells. Neurochem Int. 2009 Sep;55(4):219–25.",19524112
"Kranendijk M, Struys EA, van Schaftingen E, Gibson KM, Kanhai WA, van der Knaap MS, et al. IDH2 mutations in patients with D-2-hydroxyglutaric aciduria. Science. 2010 Oct 15;330(6002):336.",20847235
