citation,pmid
"Hauf S, Roitinger E, Koch B, Dittrich CM, Mechtler K, Peters J-M. Dissociation of cohesin from chromosome arms and loss of arm cohesion during early mitosis depends on phosphorylation of SA2. PLoS Biol. 2005 Mar;3(3):e69.",15737063
"Liu J, Krantz ID. Cornelia de Lange syndrome, cohesin, and beyond. Clin Genet. 2009 Oct;76(4):303–14.",19793304
"Whelan G, Kreidl E, Wutz G, Egner A, Peters J-M, Eichele G. Cohesin acetyltransferase Esco2 is a cell viability factor and is required for cohesion in pericentric heterochromatin. EMBO J. 2012 Jan 4;31(1):71–82.",22101327
"Deardorff MA, Bando M, Nakato R, Watrin E, Itoh T, Minamino M, et al. HDAC8 mutations in Cornelia de Lange syndrome affect the cohesin acetylation cycle. Nature. 2012 Sep 13;489(7415):313–7.",22885700
"Nishiyama T, Sykora MM, Huis in ’t Veld PJ, Mechtler K, Peters J-M. Aurora B and Cdk1 mediate Wapl activation and release of acetylated cohesin from chromosomes by phosphorylating Sororin. Proc Natl Acad Sci U S A. 2013 Aug 13;110(33):13404–9.",23901111
"Muir KW, Kschonsak M, Li Y, Metz J, Haering CH, Panne D. Structure of the Pds5-Scc1 Complex and Implications for Cohesin Function. Cell Rep. 2016 Mar 8;14(9):2116–26.",26923589
Ishiguro K-I. The cohesin complex in mammalian meiosis. Genes Cells. 2019 Jan;24(1):6–30.,30479058
"Zhang Q, Liu H. Functioning mechanisms of Shugoshin-1 in centromeric cohesion during mitosis. Essays Biochem. 2020 Sep 4;64(2):289–97.",32451529
"Al-Jomah N, Mukololo L, Anjum A, Al Madadha M, Patel R. Pds5A and Pds5B Display Non-redundant Functions in Mitosis and Their Loss Triggers Chk1 Activation. Front Cell Dev Biol. 2020 Jul 14;8:531.",32760717
