citation,pmid
"Li L, Kaplan J. Characterization of yeast methyl sterol oxidase (ERG25) and identification of a human homologue. J Biol Chem. 1996 Jul 12;271(28):16927–33.",8663358
"Noshiro M, Aoyama Y, Kawamoto T, Gotoh O, Horiuchi T, Yoshida Y. Structural and evolutionary studies on sterol 14-demethylase P450 (CYP51), the most conserved P450 monooxygenase: I. Structural analyses of the gene and multiple sizes of mRNA. J Biochem. 1997 Dec;122(6):1114–21.",9498553
"Ohashi M, Mizushima N, Kabeya Y, Yoshimori T. Localization of mammalian NAD(P)H steroid dehydrogenase-like protein on lipid droplets. J Biol Chem. 2003 Sep 19;278(38):36819–29.",12837764
"Sagami H, Korenaga T, Ogura K. Geranylgeranyl diphosphate synthase catalyzing the single condensation between isopentenyl diphosphate and farnesyl diphosphate. J Biochem. 1993 Jul;114(1):118–21.",8407863
"Liu XY, Dangel AW, Kelley RI, Zhao W, Denny P, Botcherby M, et al. The gene mutated in bare patches and striated mice encodes a novel 3beta-hydroxysteroid dehydrogenase. Nat Genet. 1999 Jun;22(2):182–7.",10369263
"Bard M, Bruner DA, Pierson CA, Lees ND, Biermann B, Frye L, et al. Cloning and characterization of ERG25, the Saccharomyces cerevisiae gene encoding C-4 sterol methyl oxidase. Proc Natl Acad Sci U S A. 1996 Jan 9;93(1):186–90.",8552601
Gaylor JL. Membrane-bound enzymes of cholesterol synthesis from lanosterol. Biochem Biophys Res Commun. 2002 Apr 19;292(5):1139–46.,11969204
